name,displayName,description,module,path,standalone
"advanced-elicitation","Advanced Elicitation","When called from workflow","core","_bmad/core/tasks/advanced-elicitation.xml","true"
"index-docs","Index Docs","Generates or updates an index.md of all documents in the specified directory","core","_bmad/core/tasks/index-docs.xml","true"
"review-adversarial-general","Adversarial Review (General)","Cynically review content and produce findings","core","_bmad/core/tasks/review-adversarial-general.xml","false"
"validate-workflow","Validate Workflow Output","Run a checklist against a document with thorough analysis and produce a validation report","core","_bmad/core/tasks/validate-workflow.xml","false"
"workflow","Execute Workflow","Execute given workflow by loading its configuration, following instructions, and producing output","core","_bmad/core/tasks/workflow.xml","false"
